{
  "schema_version": "sas-canonical-path-registry/v1",
  "repository": "EndeavorEverlasting/SysAdminSuite",
  "default_profile": "windows-development",
  "policy": {
    "remote_main_contains_sha_is_not_workstation_deployment_proof": true,
    "canonical_development_checkout_must_be_unique": true,
    "second_mutable_clone_is_forbidden": true,
    "preserve_unique_or_dirty_work": true,
    "parallel_writers_use_isolated_worktrees": true,
    "ephemeral_acquisition_checkout_never_becomes_canonical_by_existence": true,
    "production_use_path_requires_independent_currentness_proof": true,
    "operator_entrypoint_requires_independent_observation_proof": true,
    "profile_parameters_are_independent": true,
    "onedrive_toggle_does_not_choose_desktop_location": true,
    "desktop_dev_root_is_authoritative": true,
    "user_identity_is_runtime_data_not_tracked_fixture": true
  },
  "profile_parameters": {
    "required": ["os", "user", "onedrive_enabled", "desktop_dev_root"],
    "resolution_order": [
      "explicit invocation value",
      "local operating-system or environment observation",
      "registered profile fallback"
    ],
    "fields": {
      "os": {
        "type": "enum",
        "allowed": ["windows", "linux", "macos"],
        "source": "Explicit override or local operating-system observation.",
        "purpose": "Select path semantics and reject a machine-role profile that does not support the observed OS."
      },
      "user": {
        "type": "string",
        "source": "Explicit override or current local account identity.",
        "purpose": "Bind path resolution to the actual user profile without committing a real username to tracked fixtures."
      },
      "onedrive_enabled": {
        "type": "boolean",
        "source": "Explicit override or presence of a local OneDrive root environment value.",
        "purpose": "Record whether OneDrive participates in the user profile; this toggle never guesses or rewrites the Desktop location."
      },
      "desktop_dev_root": {
        "type": "path",
        "source": "Explicit override or the operating system's resolved Desktop known-folder plus Dev.",
        "purpose": "Authoritative mutable development root for this user, regardless of whether Desktop is local or OneDrive-backed."
      }
    },
    "composition": {
      "canonical_development_checkout": "selected profile path template with {desktop_dev_root}",
      "identity": "{os}|{user}|onedrive={onedrive_enabled}|desktop_dev={desktop_dev_root}"
    }
  },
  "proof_states": [
    {
      "id": "remote_default_contains_sha",
      "proves": "The configured remote default branch contains the intended commit.",
      "does_not_prove": "Any local checkout, production/use path, or operator entrypoint is current."
    },
    {
      "id": "canonical_development_checkout_current",
      "proves": "The registered canonical development checkout resolves to the intended commit with preserved local work.",
      "does_not_prove": "The production/use path has been updated."
    },
    {
      "id": "production_use_path_current",
      "proves": "The registered installed/served/field runtime was derived or updated from the intended commit and its owning verification passed.",
      "does_not_prove": "The real operator entrypoint is observing that runtime."
    },
    {
      "id": "operator_entrypoint_observes_current",
      "proves": "The real registered operator entrypoint resolves the intended production/use path and current identity.",
      "does_not_prove": "A product deployment or live target outcome succeeded."
    }
  ],
  "profiles": [
    {
      "id": "windows-development",
      "platform": "windows",
      "purpose": "Normal mutable development and repository maintenance for a resolved Windows user profile.",
      "required_profile_parameters": ["os", "user", "onedrive_enabled", "desktop_dev_root"],
      "canonical_development_checkout": {
        "template": "{desktop_dev_root}\\SysAdminSuite",
        "mutable": true,
        "purpose": "Canonical mutable SysAdminSuite development checkout composed from this user's resolved Desktop Dev root.",
        "authority": "resolved user profile plus developer checkout",
        "currentness": "profile identity plus Git identity plus refreshed remote comparison"
      },
      "production_use_path": {
        "applicable": false,
        "reason": "Development-only profile; product-specific production/use paths are owned by a field or application profile."
      },
      "temporary_worktree_root": {
        "template": "%LOCALAPPDATA%\\SysAdminSuite\\worktrees",
        "mutable": true,
        "purpose": "Collision-isolated branch/worktree execution without creating a second canonical clone."
      },
      "ephemeral_acquisition_patterns": ["%LOCALAPPDATA%\\SysAdminSuite\\closeout-entry-*", "%TEMP%\\SysAdminSuite-*"],
      "real_operator_entrypoint": {
        "authority": "harness/api/harness-command-registry.json",
        "resolution": "Select the task's registered command/front door only after user-profile, canonical-path, and freshness proof."
      }
    },
    {
      "id": "windows-admin-box",
      "platform": "windows",
      "purpose": "Admin workstation development plus sealed field-runtime use for a resolved Windows user profile.",
      "required_profile_parameters": ["os", "user", "onedrive_enabled", "desktop_dev_root"],
      "canonical_development_checkout": {
        "template": "{desktop_dev_root}\\SysAdminSuite",
        "mutable": true,
        "purpose": "Canonical mutable SysAdminSuite development checkout composed from this Admin Box user's resolved Desktop Dev root.",
        "authority": "resolved user profile plus developer checkout",
        "currentness": "profile identity plus Git identity plus refreshed remote comparison"
      },
      "production_use_path": {
        "applicable": true,
        "template": "C:\\SASAL",
        "mutable": false,
        "purpose": "Short sealed AutoLogon field runtime staged by the owning refresh/bootstrap workflow.",
        "currentness": "sealed runtime manifest and owning runtime-seal verification"
      },
      "temporary_worktree_root": {
        "template": "%LOCALAPPDATA%\\SysAdminSuite\\worktrees",
        "mutable": true,
        "purpose": "Isolated repository work only; never the installed field runtime."
      },
      "ephemeral_acquisition_patterns": ["%LOCALAPPDATA%\\SysAdminSuite\\closeout-entry-*"],
      "real_operator_entrypoint": {
        "authority": "harness/api/operator-execution-route-registry.json",
        "installed_locator": "sas",
        "production_runtime_entrypoint": "C:\\SASAL\\Bootstrap-SysAdminSuiteAutoLogon.cmd",
        "resolution": "Operator execution routing selects the registered front door and proves the resolved path before execution."
      }
    },
    {
      "id": "linux-development",
      "platform": "linux",
      "purpose": "Normal mutable development and repository maintenance for a resolved Linux user profile.",
      "required_profile_parameters": ["os", "user", "onedrive_enabled", "desktop_dev_root"],
      "canonical_development_checkout": {
        "template": "{desktop_dev_root}/SysAdminSuite",
        "mutable": true,
        "purpose": "Canonical mutable SysAdminSuite development checkout composed from this Linux user's resolved Desktop Dev root.",
        "authority": "resolved user profile plus developer checkout",
        "currentness": "profile identity plus Git identity plus refreshed remote comparison"
      },
      "production_use_path": {
        "applicable": false,
        "reason": "Development-only profile; product-specific installed or served runtimes require their own profile authority."
      },
      "temporary_worktree_root": {
        "template": "$XDG_CACHE_HOME/SysAdminSuite/worktrees or $HOME/.cache/SysAdminSuite/worktrees",
        "mutable": true,
        "purpose": "Collision-isolated Git worktrees outside the canonical mutable checkout."
      },
      "ephemeral_acquisition_patterns": ["$TMPDIR/SysAdminSuite-*", "/tmp/SysAdminSuite-*"],
      "real_operator_entrypoint": {
        "authority": "harness/api/harness-command-registry.json",
        "resolution": "Select a registered repository command only after user-profile, canonical-path, and freshness proof."
      }
    },
    {
      "id": "macos-development",
      "platform": "macos",
      "purpose": "Normal mutable development and repository maintenance for a resolved macOS user profile.",
      "required_profile_parameters": ["os", "user", "onedrive_enabled", "desktop_dev_root"],
      "canonical_development_checkout": {
        "template": "{desktop_dev_root}/SysAdminSuite",
        "mutable": true,
        "purpose": "Canonical mutable SysAdminSuite development checkout composed from this macOS user's resolved Desktop Dev root.",
        "authority": "resolved user profile plus developer checkout",
        "currentness": "profile identity plus Git identity plus refreshed remote comparison"
      },
      "production_use_path": {
        "applicable": false,
        "reason": "Development-only profile; product-specific installed or served runtimes require their own profile authority."
      },
      "temporary_worktree_root": {
        "template": "$HOME/Library/Caches/SysAdminSuite/worktrees",
        "mutable": true,
        "purpose": "Collision-isolated Git worktrees outside the canonical mutable checkout."
      },
      "ephemeral_acquisition_patterns": ["$TMPDIR/SysAdminSuite-*", "/tmp/SysAdminSuite-*"],
      "real_operator_entrypoint": {
        "authority": "harness/api/harness-command-registry.json",
        "resolution": "Select a registered repository command only after user-profile, canonical-path, and freshness proof."
      }
    }
  ],
  "consumers": [
    "harness/workflows/fresh-agent-intake.yaml",
    "harness/workflows/repository-freshness-before-launch.yaml",